{
 "schema_version": "result.v1",
 "document_id": "00000000-0000-4000-8000-000000000007",
 "received_at": null,
 "source": "synthetic",
 "page_count": 1,
 "status": "needs_check",
 "review": {
  "needs_check_count": 0,
  "items": []
 },
 "absent": [],
 "patient": {
  "name": {
   "value": "Dr. Sunil Notreal",
   "status": "needs_check",
   "confidence": 0.6,
   "evidence": {
    "page": 1,
    "bbox": [
     10,
     10,
     200,
     30
    ],
    "observation_ids": [
     "o1"
    ]
   },
   "reason": "held for a person"
  },
  "age_text": {
   "value": "48 Y",
   "status": "accepted",
   "confidence": 0.97,
   "evidence": {
    "page": 1,
    "bbox": [
     10,
     10,
     200,
     30
    ],
    "observation_ids": [
     "o1"
    ]
   }
  },
  "sex": {
   "value": "female",
   "status": "accepted",
   "confidence": 0.97,
   "evidence": {
    "page": 1,
    "bbox": [
     10,
     10,
     200,
     30
    ],
    "observation_ids": [
     "o1"
    ]
   }
  },
  "phone": {
   "value": "9876543216",
   "status": "accepted",
   "confidence": 0.97,
   "evidence": {
    "page": 1,
    "bbox": [
     10,
     10,
     200,
     30
    ],
    "observation_ids": [
     "o1"
    ]
   }
  },
  "address": {
   "value": "7 Example Road, Sampletown",
   "status": "accepted",
   "confidence": 0.97,
   "evidence": {
    "page": 1,
    "bbox": [
     10,
     10,
     200,
     30
    ],
    "observation_ids": [
     "o1"
    ]
   }
  }
 },
 "doctor": {
  "name": {
   "value": "Dr. Sunil Notreal",
   "status": "accepted",
   "confidence": 0.97,
   "evidence": {
    "page": 1,
    "bbox": [
     10,
     10,
     200,
     30
    ],
    "observation_ids": [
     "o1"
    ]
   }
  },
  "registration_no": {
   "value": "70003",
   "status": "accepted",
   "confidence": 0.97,
   "evidence": {
    "page": 1,
    "bbox": [
     10,
     10,
     200,
     30
    ],
    "observation_ids": [
     "o1"
    ]
   }
  },
  "qualification": {
   "value": "MBBS, DNB",
   "status": "accepted",
   "confidence": 0.97,
   "evidence": {
    "page": 1,
    "bbox": [
     10,
     10,
     200,
     30
    ],
    "observation_ids": [
     "o1"
    ]
   }
  }
 },
 "lab_tests": [
  {
   "as_written": "HbA1c",
   "kind": "test",
   "match": "matched",
   "standard": {
    "name": "HbA1c",
    "code_system": "LOINC",
    "code": "4548-4"
   },
   "value": {
    "value": "HbA1c",
    "status": "accepted",
    "confidence": 0.97,
    "evidence": {
     "page": 1,
     "bbox": [
      10,
      10,
      200,
      30
     ],
     "observation_ids": [
      "o1"
     ]
    }
   },
   "context": [
    {
     "type": "diagnosis",
     "text": "Type 2 diabetes mellitus",
     "relation": "same_page",
     "quote": "Type 2 diabetes mellitus"
    }
   ]
  },
  {
   "as_written": "Lipid profile",
   "kind": "test",
   "match": "matched",
   "standard": {
    "name": "Lipid profile",
    "code_system": "LOINC",
    "code": "LT0012"
   },
   "value": {
    "value": "Lipid profile",
    "status": "accepted",
    "confidence": 0.97,
    "evidence": {
     "page": 1,
     "bbox": [
      10,
      10,
      200,
      30
     ],
     "observation_ids": [
      "o1"
     ]
    }
   },
   "context": [
    {
     "type": "diagnosis",
     "text": "Dyslipidaemia",
     "relation": "same_page",
     "quote": "Dyslipidaemia"
    }
   ]
  }
 ],
 "preparation": [
  {
   "value": "fasting 12 hrs",
   "status": "accepted",
   "confidence": 0.97,
   "evidence": {
    "page": 1,
    "bbox": [
     10,
     10,
     200,
     30
    ],
    "observation_ids": [
     "o1"
    ]
   },
   "text": "fasting 12 hrs",
   "type": "fasting",
   "amount": 12,
   "unit": "h",
   "applies_to": [
    "Lipid profile"
   ],
   "instruction": "fasting"
  }
 ]
}
